{
  "catalog_version": "2026.08.1",
  "generated_at": "2026-08-02T04:59:03Z",
  "items": [
    {
      "aliases": [
        "embedding-3"
      ],
      "api_model_id": "embedding-3",
      "canonical_id": "zhipu/embedding-3",
      "family": "Embedding",
      "input_modalities": [
        "text"
      ],
      "kind": "embedding",
      "name": "Embedding-3",
      "offering_id": "zhipu/embedding-3",
      "output_modalities": [
        "vector"
      ],
      "provider_id": "zhipu",
      "provider_name": "智谱开放平台",
      "status": "active"
    },
    {
      "aliases": [
        "glm-4.6v"
      ],
      "api_model_id": "glm-4.6v",
      "canonical_id": "zhipu/glm-4.6v",
      "family": "GLM-4.6V",
      "input_modalities": [
        "text",
        "image",
        "video",
        "file"
      ],
      "kind": "chat",
      "name": "GLM-4.6V",
      "offering_id": "zhipu/glm-4.6v",
      "output_modalities": [
        "text"
      ],
      "provider_id": "zhipu",
      "provider_name": "智谱开放平台",
      "status": "active"
    },
    {
      "aliases": [
        "glm-5.2"
      ],
      "api_model_id": "glm-5.2",
      "canonical_id": "zhipu/glm-5.2",
      "family": "GLM-5",
      "input_modalities": [
        "text"
      ],
      "kind": "chat",
      "name": "GLM-5.2",
      "offering_id": "zhipu/glm-5.2",
      "output_modalities": [
        "text"
      ],
      "provider_id": "zhipu",
      "provider_name": "智谱开放平台",
      "status": "active"
    },
    {
      "aliases": [
        "gpt-5.5",
        "gpt-5.5-2026-04-23"
      ],
      "api_model_id": "gpt-5.5",
      "canonical_id": "openai/gpt-5.5",
      "family": "GPT-5",
      "input_modalities": [
        "text",
        "image"
      ],
      "kind": "chat",
      "name": "GPT-5.5",
      "offering_id": "openai/gpt-5.5",
      "output_modalities": [
        "text"
      ],
      "provider_id": "openai",
      "provider_name": "OpenAI",
      "status": "active"
    }
  ],
  "schema_version": "2.0.0"
}
